[
  {
    "code": "852GC2003",
    "name": "OK便利店 (青衣)",
    "name_en": "Conv. Store Shop 6, G/F, Carpark Building Phase I, Tsing Yi Estate, Tsing Yi, N.T.",
    "address": "新界青衣青衣村一期停車場大廈地下6號舖",
    "address_en": "Shop 6, G/F, Carpark Building Phase I, Tsing Yi Estate, Tsing Yi, N.T.",
    "district": "葵青區",
    "district_en": "Kwai Tsing District",
    "sub_district": "青衣",
    "sub_district_en": "Tsing Yi",
    "business_hours": "24小時",
    "business_hours_en": "00:00-23:59",
    "source_key": "OK_NT_TC",
    "source_url": "https://hk.sf-express.com/uploads/OK_NT_TC.pdf",
    "reviewed_source_url": "https://hk.sf-express.com/uploads/OK_NT_TC_6df1516024.pdf",
    "reviewed_document_sha256": "8c9fd67e2458bcca149b7556c71a2d0908b5fc9e0c930ec01bbcc5e5baa7695d",
    "reviewed_source_retrieved_at": "2026-07-27 15:49 (HKT UTC+8)",
    "reviewed": true,
    "reviewed_at": "2026-07-27",
    "review_note": "Verified against official SF Express partner PDF"
  },
  {
    "code": "852LA3007",
    "name": "葵涌康力達環保貿易公司",
    "name_en": null,
    "address": "葵涌和宜合道167-175號金威工業大廈一期低層地下B7室",
    "address_en": null,
    "district": "葵青區",
    "district_en": "Kwai Tsing District",
    "sub_district": "葵涌",
    "sub_district_en": null,
    "business_hours": "星期一至六:12:00-18:00 星期日及公眾假期:休息",
    "business_hours_en": null,
    "source_key": "ASP_NT_TC",
    "source_url": "https://hk.sf-express.com/uploads/ASP_NT_TC.pdf",
    "reviewed_source_url": "https://hk.sf-express.com/uploads/ASP_NT_TC_307f591507.pdf",
    "reviewed_document_sha256": "c0f4ffc4d15d126151195450d0d91fc89dbc64f0281c281eb07f92e51a979432",
    "reviewed_source_retrieved_at": "2026-07-27 15:49 (HKT UTC+8)",
    "reviewed": true,
    "reviewed_at": "2026-07-27",
    "review_note": "Verified against official SF Express partner PDF"
  },
  {
    "code": "852FE3012",
    "name": "馬鞍山錦英苑自提點",
    "name_en": null,
    "address": "馬鞍山錦英苑街市16號",
    "address_en": null,
    "district": "沙田區",
    "district_en": "Sha Tin District",
    "sub_district": "馬鞍山",
    "sub_district_en": null,
    "business_hours": "星期一至六:12:00-20:00 星期日及公眾假期:12:00-18:00",
    "business_hours_en": null,
    "source_key": "ASP_NT_TC",
    "source_url": "https://hk.sf-express.com/uploads/ASP_NT_TC.pdf",
    "reviewed_source_url": "https://hk.sf-express.com/uploads/ASP_NT_TC_307f591507.pdf",
    "reviewed_document_sha256": "c0f4ffc4d15d126151195450d0d91fc89dbc64f0281c281eb07f92e51a979432",
    "reviewed_source_retrieved_at": "2026-07-27 15:49 (HKT UTC+8)",
    "reviewed": true,
    "reviewed_at": "2026-07-27",
    "review_note": "Verified against official SF Express partner PDF; stripped limit prefix label"
  },
  {
    "code": "852G3004",
    "name": "荃灣提點坪有限公司",
    "name_en": null,
    "address": "新界荃灣石圍角邨石芳樓210號舖",
    "address_en": null,
    "district": "荃灣區",
    "district_en": "Tsuen Wan District",
    "sub_district": "荃灣",
    "sub_district_en": null,
    "business_hours": "星期一至六: 12:00-20:30 星期日、公眾假期: 休息",
    "business_hours_en": null,
    "source_key": "ASP_NT_TC",
    "source_url": "https://hk.sf-express.com/uploads/ASP_NT_TC.pdf",
    "reviewed_source_url": "https://hk.sf-express.com/uploads/ASP_NT_TC_307f591507.pdf",
    "reviewed_document_sha256": "c0f4ffc4d15d126151195450d0d91fc89dbc64f0281c281eb07f92e51a979432",
    "reviewed_source_retrieved_at": "2026-07-27 15:49 (HKT UTC+8)",
    "reviewed": true,
    "reviewed_at": "2026-07-27",
    "review_note": "Verified against official SF Express partner PDF; stripped limit prefix label"
  },
  {
    "code": "852G3008",
    "name": "荃灣星羽便利店",
    "name_en": null,
    "address": "荃灣享和街47號都城大樓地下C1舖（7-11旁）",
    "address_en": null,
    "district": "荃灣區",
    "district_en": "Tsuen Wan District",
    "sub_district": "荃灣",
    "sub_district_en": null,
    "business_hours": "星期一至六:10:00-21:00 星期日:10:00-21:00 公眾假期:休息",
    "business_hours_en": null,
    "source_key": "ASP_NT_TC",
    "source_url": "https://hk.sf-express.com/uploads/ASP_NT_TC.pdf",
    "reviewed_source_url": "https://hk.sf-express.com/uploads/ASP_NT_TC_307f591507.pdf",
    "reviewed_document_sha256": "c0f4ffc4d15d126151195450d0d91fc89dbc64f0281c281eb07f92e51a979432",
    "reviewed_source_retrieved_at": "2026-07-27 15:49 (HKT UTC+8)",
    "reviewed": true,
    "reviewed_at": "2026-07-27",
    "review_note": "Verified against official SF Express partner PDF; stripped limit prefix label"
  }
]
